Title,Category,Best Paper
Research on Task Discovery for Transfer Learning in Deep Neural Networks,Data Mining,FALSE
Research Replication Prediction Using Weakly Supervised Learning,Data Mining,FALSE
RPD: A Distance Function Between Word Embeddings,Data Mining,FALSE
SCAR: Sentence Compression using Autoencoders for Reconstruction,Data Mining,FALSE
Self-Attention is Not Only a Weight: Analyzing BERT with Vector Norms,Data Mining,FALSE
Story-level Text Style Transfer: A Proposal,Data Mining,FALSE
To compress or not to compress? A Finite-State approach to Nen verbal morphology,Data Mining,FALSE
Topic balancing with additive regularization of topic models,Data Mining,FALSE
Transferring Monolingual Model to Low-Resource Language: The Case of Tigrinya,Data Mining,FALSE
Understanding Points of Correspondence between Sentences for Abstractive Summarization,Data Mining,FALSE
Unsupervised Multilingual Sentence Embeddings for Parallel Corpus Mining,Data Mining,FALSE
Unsupervised Paraphasia Classification in Aphasic Speech,Data Mining,FALSE
Why is penguin more similar to polar bear than to sea gull? Analyzing conceptual knowledge in distributional models,Data Mining,FALSE
Zero-shot North Korean to English Neural Machine Translation by Character Tokenization and Phoneme Decomposition,Data Mining,FALSE
