Title,Category,Best Paper
Bug or Feature? Covert Impairments to Human Computer Interaction,Software Engineering,True
Investigating Opportunities for Crowdsourcing in Church-Based Health Interventions: A Participatory Design Study,Software Engineering,False
KirigamiTable: Designing for Proxemic Transitions with a Shape-Changing Tabletop,Software Engineering,False
Improving Crowd-Supported GUI Testing with Structural Guidance,Software Engineering,False
EarBuddy: Enabling On-Face Interaction via Wireless Earbuds,Software Engineering,False
Supporting Self-Regulation of Children with ADHD Using Wearables: Tensions and Design Challenges,Software Engineering,False
PneuModule: Using Inflatable Pin Arrays for Reconfigurable Physical Controls on Pressure-Sensitive Touch Surfaces,Software Engineering,True
Mix&Match: Towards Omitting Modelling Through In-situ Remixing of Model Repository Artifacts in Mixed Reality,Software Engineering,False
The Role of Eye Gaze in Security and Privacy Applications: Survey and Future HCI Research Directions,Software Engineering,True
PolySense: Augmenting Textiles with Electrical Functionality using In-Situ Polymerization,Software Engineering,False
Interaction Techniques for Visual Exploration Using Embedded Word-Scale Visualizations,Software Engineering,False
Effects of Persuasive Dialogues: Testing Bot Identities and Inquiry Strategies,Software Engineering,False
Imagining Data-Objects for Reflective Self-Tracking,Software Engineering,False
Instructional Video Design: Investigating the Impact of Monologue- and Dialogue-style Presentations,Software Engineering,False
Unwind: Interactive Fish Straightening,Software Engineering,False
WalkingVibe: Reducing Virtual Reality Sickness and Improving Realism while Walking in VR using Unobtrusive Head-mounted Vibrotactile Feedback,Software Engineering,False
"Heatmaps, Shadows, Bubbles, Rays: Comparing Mid-Air Pen Position Visualizations in Handheld AR",Software Engineering,False
Keep it Simple: How Visual Complexity and Preferences Impact Search Efficiency on Websites,Software Engineering,False
Determining the Extractive Casting Mold of Intimate Platforms through Document Theory,Software Engineering,True
NurseCare: Design and 'In-The-Wild' Evaluation of a Mobile System to Promote the Ergonomic Transfer of Patients,Software Engineering,False
Walk The Line: Leveraging Lateral Shifts of the Walking Path as an Input Modality for Head-Mounted Displays,Software Engineering,False
Checklist Design Reconsidered: Understanding Checklist Compliance and Timing of Interactions,Software Engineering,False
Online Privacy Heuristics that Predict Information Disclosure,Software Engineering,False
Social Sensing: Assessing Social Functioning of Patients Living with Schizophrenia using Mobile Phone Sensing,Software Engineering,False
Household Surface Interactions: Understanding User Input Preferences and Perceived Home Experiences,Software Engineering,False
Engaging Students with Instructor Solutions in Online Programming Homework,Software Engineering,False
Interspecies Interactions Mediated by Technology: An Avian Case Study at the Zoo,Software Engineering,False
Technology for Situated and Emergent Play: A Bridging Concept and Design Agenda,Software Engineering,False
An Experimental Study of Bias in Platform Worker Ratings: The Role of Performance Quality and Gender,Software Engineering,False
Comparing Smartphone Speech Recognition and Touchscreen Typing for Composition and Transcription,Software Engineering,False
Understanding the Use of Crisis Informatics Technology among Older Adults,Software Engineering,False
Voice+Tactile: Augmenting In-vehicle Voice User Interface with Tactile Touchpad Interaction,Software Engineering,False
Let's Draw: Detecting and Measuring Parkinson's Disease on Smartphones,Software Engineering,False
Gaiters: Exploring Skin Stretch Feedback on Legs for Enhancing Virtual Reality Experiences,Software Engineering,False
DFSeer: A Visual Analytics Approach to Facilitate Model Selection for Demand Forecasting,Software Engineering,False
Relational Aspects in Patient-provider Interactions: A Facial Paralysis Case Study,Software Engineering,False
HeadReach: Using Head Tracking to Increase Reachability on Mobile Touch Devices,Software Engineering,False
FitByte: Automatic Diet Monitoring in Unconstrained Situations Using Multimodal Sensing on Eyeglasses,Software Engineering,False
Modeling Human Visual Search Performance on Realistic Webpages Using Analytical and Deep Learning Methods,Software Engineering,False
Future Opportunities for IoT to Support People with Parkinson's,Software Engineering,False
Investigating Representation of Text and Audio in Educational VR using Learning Outcomes and EEG,Software Engineering,False
"""Why is 'Chicago' deceptive?"" Towards Building Model-Driven Tutorials for Humans",Software Engineering,False
"Race, Gender and Beauty: The Effect of Information Provision on Online Hiring Biases",Software Engineering,False
Automated Class Discovery and One-Shot Interactions for Acoustic Activity Recognition,Software Engineering,True
Understanding the Heisenberg Effect of Spatial Interaction: A Selection Induced Error for Spatially Tracked Input Devices,Software Engineering,False
How to Trick AI: Users' Strategies for Protecting Themselves from Automatic Personality Assessment,Software Engineering,False
How Relevant is Hick's Law for HCI?,Software Engineering,False
MUBS: A Personalized Recommender System for Behavioral Activation in Mental Health,Software Engineering,False
Dziban: Balancing Agency & Automation in Visualization Design via Anchored Recommendations,Software Engineering,False
Understanding Cybersecurity Practices in Emergency Departments,Software Engineering,False
QMaps: Engaging Students in Voluntary Question Generation and Linking,Software Engineering,False
Who Are You Asking?: Qualitative Methods for Involving AAC Users as Primary Research Participants,Software Engineering,False
Autonomous Vehicle-Cyclist Interaction: Peril and Promise,Software Engineering,False
Metro Futures: Experience-Centred Co-Design at Scale,Software Engineering,False
Auditory Display in Interactive Science Simulations: Description and Sonification Support Interaction and Enhance Opportunities for Learning,Software Engineering,False
Pushing the (Visual) Narrative: The Effects of Prior Knowledge Elicitation in Provocative Topics,Software Engineering,False
Squeeze the Ball: Designing an Interactive Playground towards Aiding Social Activities of Children with Low-Function Autism,Software Engineering,False
Under Surveillance: Technology Practices of those Monitored by the State,Software Engineering,False
