Title,Category,Best Paper
UI Dark Patterns and Where to Find Them: A Study on Mobile Applications and User Perception,Software Engineering,False
Closer Object Looks Smaller: Investigating the Duality of Size Perception in a Spherical Fish Tank VR Display,Software Engineering,False
Relationship Between Visual Complexity and Aesthetics of Webpages,Software Engineering,False
Join.Love: A Sociotechnical Genealogy of the Legalization of Same-Sex Marriage,Software Engineering,False
Who Put That There? Temporal Navigation of Spatial Recordings by Direct Manipulation,Software Engineering,False
"""We Hold Each Other Accountable"": Unpacking How Social Groups Approach Cybersecurity and Privacy Together",Software Engineering,True
"""How do I make this thing smile?"": An Inventory of Expressive Nonverbal Communication in Commercial Social Virtual Reality Platforms",Software Engineering,False
"""You Cannot Offer Such a Suggestion"": Designing for Family Caregiver Input in Home Care Systems",Software Engineering,False
Scenario Co-Creation Cards: A Culturally Sensitive Tool for Eliciting Values,Software Engineering,True
SolutionChat: Real-time Moderator Support for Chat-based Structured Discussion,Software Engineering,False
ORCSolver: An Efficient Solver for Adaptive GUI Layout with OR-Constraints,Software Engineering,False
"'Lime', 'Open Lock', and 'Blocked': Children's Perception of Colors, Symbols, and Words in Cybersecurity Warnings",Software Engineering,False
The Government's Dividend: Complex Perceptions of Social Media Misinformation in China,Software Engineering,False
"Embodied Axes: Tangible, Actuated Interaction for 3D Augmented Reality Data Spaces",Software Engineering,False
ARchitect: Building Interactive Virtual Experiences from Physical Affordances by Bringing Human-in-the-Loop,Software Engineering,False
COGAM: Measuring and Moderating Cognitive Load in Machine Learning Model Explanations,Software Engineering,False
TandemTrack: Shaping Consistent Exercise Experience by Complementing a Mobile App with a Smart Speaker,Software Engineering,False
CurveBoards: Integrating Breadboards into Physical Objects to Prototype Function in the Context of Form,Software Engineering,False
ICONATE: Automatic Compound Icon Generation and Ideation,Software Engineering,False
Body-Penetrating Tactile Phantom Sensations,Software Engineering,False
Sensitizing Scenarios: Sensitizing Designer Teams to Theory,Software Engineering,False
Digital Fabrication Tools at Work: Probing Professionals' Current Needs and Desired Futures,Software Engineering,False
Remotely Shaping the View in Surgical Telementoring,Software Engineering,False
Collaborative Aspects of Collecting and Reflecting on Behavioral Data,Software Engineering,False
No Explainability without Accountability: An Empirical Study of Explanations and Feedback in Interactive ML,Software Engineering,False
Mirror Ritual: An Affective Interface for Emotional Self-Reflection,Software Engineering,False
Podoportation: Foot-Based Locomotion in Virtual Reality,Software Engineering,False
"Relational, Flexible, Everyday: Learning from Ethics in Dementia Research",Software Engineering,False
VRSketchIn: Exploring the Design Space of Pen and Tablet Interaction for 3D Sketching in Virtual Reality,Software Engineering,False
Conversational Technologies for In-home Learning: Using Co-Design to Understand Children's and Parents' Perspectives,Software Engineering,False
The Burden of Ending Online Account Sharing,Software Engineering,False
"""We can learn. Why not?"": Designing Technologies to Engender Equity for Home Health Aides",Software Engineering,False
Be Water: Technologies in the Leaderless Anti-ELAB Movement in Hong Kong,Software Engineering,False
Adaptive Photographic Composition Guidance,Software Engineering,False
Memory through Design: Supporting Cultural Identity for Immigrants through a Paper-Based Home Drafting Tool,Software Engineering,False
XRDirector: A Role-Based Collaborative Immersive Authoring System,Software Engineering,False
A Case for Humans-in-the-Loop: Decisions in the Presence of Erroneous Algorithmic Scores,Software Engineering,False
Performance and Experience of Throwing in Virtual Reality,Software Engineering,False
Engaging with Public Art: An Exploration of the Design Space,Software Engineering,False
Designing an Eyes-Reduced Document Skimming App for Situational Impairments,Software Engineering,False
"Again, Together: Socially Reliving Virtual Reality Experiences When Separated",Software Engineering,False
Physiologically Driven Storytelling: Concept and Software Tool,Software Engineering,True
What a Driver Wants: User Preferences in Semi-Autonomous Vehicle Decision-Making,Software Engineering,True
"Fragile Masculinity: Men, Gender, and Online Harassment",Software Engineering,False
Nudge for Deliberativeness: How Interface Features Influence Online Discourse,Software Engineering,False
"Crafting, Communality, and Computing: Building on Existing Strengths To Support a Vulnerable Population",Software Engineering,False
Social Technology Appropriation in Dementia: Investigating the Role of Caregivers in Engaging People with Dementia with a Videogame-based Training System,Software Engineering,False
Isness: Using Multi-Person VR to Design Peak Mystical Type Experiences Comparable to Psychedelics,Software Engineering,True
We are the Greatest Showmen: Configuring a Framework for Project-Based Mobile Learning,Software Engineering,False
"Understanding Fitness Tracker Users' Security and Privacy Knowledge, Attitudes and Behaviours",Software Engineering,False
"""In VR, everything is possible!"": Sketching and Simulating Spatially-Aware Interactive Spaces in Virtual Reality",Software Engineering,False
Menstrual (Im)Mobilities and Safe Spaces,Software Engineering,False
The Impact of Displaying Diversity Information on the Formation of Self-assembling Teams,Software Engineering,True
Kirigami Haptic Swatches: Design Methods for Cut-and-Fold Haptic Feedback Mechanisms,Software Engineering,False
Fairness and Decision-making in Collaborative Shift Scheduling Systems,Software Engineering,False
Towards an Understanding of Augmented Reality Extensions for Existing 3D Data Analysis Tools,Software Engineering,False
"The Social Network: How People with Visual Impairment use Mobile Phones in Kibera, Kenya",Software Engineering,False
OScH in the Wild: Dissemination of Open Science Hardware and Implications for HCI,Software Engineering,False
The Blockchain and the Commons: Dilemmas in the Design of Local Platforms,Software Engineering,False
Me vs. Super(wo)man: Effects of Customization and Identification in a VR Exergame,Software Engineering,True
"Ownership, Privacy, and Control in the Wake of Cambridge Analytica: The Relationship between Attitudes and Awareness",Software Engineering,False
"Ecology Meets Computer Science: Designing Tools to Reconcile People, Data, and Practices",Software Engineering,False
Articulating Experience: Reflections from Experts Applying Micro-Phenomenology to Design Research in HCI,Software Engineering,True
Genie in the Bottle: Anthropomorphized Perceptions of Conversational Agents,Software Engineering,False
Exploring Nudge Designs to Help Adolescent SNS Users Avoid Privacy and Safety Threats,Software Engineering,True
Embodied Learning in Immersive Smart Spaces,Software Engineering,False
Better Because It's New: The Impact of Perceived Novelty on the Added Value of Mid-Air Haptic Feedback,Software Engineering,False
Designing Trans Technology: Defining Challenges and Envisioning Community-Centered Solutions,Software Engineering,True
Vipo: Spatial-Visual Programming with Functions for Robot-IoT Workflows,Software Engineering,False
"Exploring the Quality, Efficiency, and Representative Nature of Responses Across Multiple Survey Panels",Software Engineering,False
'I Just Want to Hack Myself to Not Get Distracted': Evaluating Design Interventions for Self-Control on Facebook,Software Engineering,False
RestoreVR: Generating Embodied Knowledge and Situated Experience of Dunhuang Mural Conservation via Interactive Virtual Reality,Software Engineering,False
Towards an AI-powered Future that Works for Vocational Workers,Software Engineering,False
Assessing 2D and 3D Heatmaps for Comparative Analysis: An Empirical Study,Software Engineering,False
Stop and Smell the Chalk Flowers: A Robotic Probe for Investigating Urban Interaction with Physicalised Displays,Software Engineering,False
Creativity on Paid Crowdsourcing Platforms,Software Engineering,False
Ethics in Movement: Shaping and Being Shaped in Human-Drone Interaction,Software Engineering,True
Robocalling: STIRRED AND SHAKEN! - An Investigation of Calling Displays on Trust and Answer Rates,Software Engineering,False
"The Human in Emotion Recognition on Social Media: Attitudes, Outcomes, Risks",Software Engineering,False
Fabriccio: Touchless Gestural Input on Interactive Fabrics,Software Engineering,False
ThermalWear: Exploring Wearable On-chest Thermal Displays to Augment Voice Messages with Affect,Software Engineering,False
An Empirical Comparison of Technologically Mediated Advertising in Under-connected Populations,Software Engineering,True
From Biodata to Somadata,Software Engineering,False
Makers in Healthcare: The Role of Occupational Therapists in the Design of DIY Assistive Technology,Software Engineering,False
Storywell: Designing for Family Fitness App Motivation by Using Social Rewards and Reflection,Software Engineering,False
Improving Virtual Reality Ergonomics Through Reach-Bounded Non-Linear Input Amplification,Software Engineering,True
An Exploratory Study of Augmented Reality Presence for Tutoring Machine Tasks,Software Engineering,False
Crafting Critical Heritage Discourses into Interactive Exhibition Design,Software Engineering,False
Addressing Anonymous Abuses: Measuring the Effects of Technical Mechanisms on Reported User Behaviors,Software Engineering,False
ScrAPIr: Making Web Data APIs Accessible to End Users,Software Engineering,False
Design Investigation of Embroidered Interactive Elements on Non-Wearable Textile Interfaces,Software Engineering,False
Mechanisms of Moral Responsibility: Rethinking Technologies for Domestic Violence Prevention Work,Software Engineering,False
Towards Participatory Video 2.0,Software Engineering,False
Exploring the Effects of Technological Writing Assistance for Support Providers in Online Mental Health Community,Software Engineering,False
Exploring the Design Space for Parent-Child Reading,Software Engineering,False
How Points and Theme Affect Performance and Experience in a Gamified Cognitive Task,Software Engineering,False
Get a Grip: Evaluating Grip Gestures for VR Input using a Lightweight Pen,Software Engineering,True
"Getting the Healthcare We Want: The Use of Online ""Ask the Doctor"" Platforms in Practice",Software Engineering,True
A Skin-Stroke Display on the Eye-Ring Through Head-Mounted Displays,Software Engineering,True
Predicting Mid-Air Interaction Movements and Fatigue Using Deep Reinforcement Learning,Software Engineering,False
Acoustic Transparency and the Changing Soundscape of Auditory Mixed Reality,Software Engineering,False
INWARD: A Computer-Supported Tool for Video-Reflection Improves Efficiency and Effectiveness in Executive Coaching,Software Engineering,False
Connecting Distributed Families: Camera Work for Three-party Mobile Video Calls,Software Engineering,True
Dynamic Motor Skill Synthesis with Human-Machine Mutual Actuation,Software Engineering,True
Towards Standardized Processes for Physical Therapists to Quantify Patient Rehabilitation,Software Engineering,False
BrainCoDe: Electroencephalography-based Comprehension Detection during Reading and Listening,Software Engineering,False
It Takes a Village: Integrating an Adaptive Chatbot into an Online Gaming Community,Software Engineering,False
Red Alert: A Cognitive Countermeasure to Mitigate Attentional Tunneling,Software Engineering,False
Meaningful Technology at Work - A Reflective Design Case of Improving Radiologists' Wellbeing Through Medical Technology,Software Engineering,False
How We Type: Eye and Finger Movement Strategies in Mobile Typing,Software Engineering,False
Evaluation of Machine Learning Techniques for Hand Pose Estimation on Handheld Device with Proximity Sensor,Software Engineering,False
Designing in the Network of Relations for Species Conservation: The Playful Tingtibi Community Birdhouse,Software Engineering,False
Touché: Data-Driven Interactive Sword Fighting in Virtual Reality,Software Engineering,False
Heteroglossia: In-Situ Story Ideation with the Crowd,Software Engineering,False
Feminist Living Labs as Research Infrastructures for HCI: The Case of a Video Game Company,Software Engineering,False
Positive Feedback and Self-Reflection: Features to Support Self-efficacy among Underrepresented Job Seekers,Software Engineering,False
A Human-Centered Evaluation of a Deep Learning System Deployed in Clinics for the Detection of Diabetic Retinopathy,Software Engineering,True
A Human Touch: Social Touch Increases the Perceived Human-likeness of Agents in Virtual Reality,Software Engineering,False
Augmented Reality Training for Industrial Assembly Work - Are Projection-based AR Assistive Systems an Appropriate Tool for Assembly Training?,Software Engineering,False
transTexture Lamp: Understanding Lived Experiences with Deformation Through a Materiality Lens,Software Engineering,False
"Creating Augmented and Virtual Reality Applications: Current Practices, Challenges, and Opportunities",Software Engineering,True
Self-Determination Theory in HCI Games Research: Current Uses and Open Questions,Software Engineering,True
"""Transport Me Away"": Fostering Flow in Open Offices through Virtual Reality",Software Engineering,False
An Intermittent Click Planning Model,Software Engineering,True
VoiceCoach: Interactive Evidence-based Training for Voice Modulation Skills in Public Speaking,Software Engineering,False
What is AI Literacy? Competencies and Design Considerations,Software Engineering,True
Twitter A11y: A Browser Extension to Make Twitter Images Accessible,Software Engineering,False
"What's Wrong with Computational Notebooks? Pain Points, Needs, and Design Opportunities",Software Engineering,True
Interacting with Literary Style through Computational Tools,Software Engineering,False
To Write Code: The Cultural Fabrication of Programming Notation and Practice,Software Engineering,True
AL: An Adaptive Learning Support System for Argumentation Skills,Software Engineering,True
Scents and Sensibility: Evaluating Information Olfactation,Software Engineering,False
"In-game and Out-of-game Social Anxiety Influences Player Motivations, Activities, and Experiences in MMORPGs",Software Engineering,False
Optimal Sensor Position for a Computer Mouse,Software Engineering,False
Investigating Collaborative Exploration of Design Alternatives on a Wall-Sized Display,Software Engineering,False
On-Face Olfactory Interfaces,Software Engineering,False
Charge for a whole day: Extending Battery Life for BCI Wearables using a Lightweight Wake-Up Command,Software Engineering,False
Novice-AI Music Co-Creation via AI-Steering Tools for Deep Generative Models,Software Engineering,False
"Callisto: Capturing the ""Why"" by Connecting Conversations with Computational Narratives",Software Engineering,True
What HCI Can Learn from ASMR: Becoming Enchanted with the Mundane,Software Engineering,False
Getting out of Out of Sight: Evaluation of AR Mechanisms for Awareness and Orientation Support in Occluded Multi-Room Settings,Software Engineering,False
"In Helping a Vulnerable Bot, You Help Yourself: Designing a Social Bot as a Care-Receiver to Promote Mental Health and Reduce Stigma",Software Engineering,False
"Disseminating Research News in HCI: Perceived Hazards, How-To's, and Opportunities for Innovation",Software Engineering,False
Lawful Users: Copyright Circumvention and Legal Constraints on Technology Use,Software Engineering,False
Spinneret: Aiding Creative Ideation through Non-Obvious Concept Associations,Software Engineering,False
Circle of Trust: A New Approach to Mobile Online Safety for Families,Software Engineering,False
"The Curious Case of the Transdiegetic Cow, or a Mission to Foster Other-Oriented Empathy Through Virtual Reality",Software Engineering,False
Review of Quantitative Empirical Evaluations of Technology for People with Visual Impairments,Software Engineering,True
Practicing Without a License: Design Research as Psychotherapy,Software Engineering,False
Self-Interruptions of Non-Driving Related Tasks in Automated Vehicles: Mobile vs Head-Up Display,Software Engineering,False
Welcome to the Course: Early Social Cues Influence Women's Persistence in Computer Science,Software Engineering,False
ScreenTrack: Using a Visual History of a Computer Screen to Retrieve Documents and Web Pages,Software Engineering,False
Building and Validating a Scale for Secure Software Development Self-Efficacy,Software Engineering,False
Exploring How Game Genre in Student-Designed Games Influences Computational Thinking Development,Software Engineering,True
Zippro: The Design and Implementation of An Interactive Zipper,Software Engineering,False
"Evaluating a Personalizable, Inconspicuous Vibrotactile(PIV) Breathing Pacer for In-the-Moment Affect Regulation",Software Engineering,True
HomeSound: An Iterative Field Deployment of an In-Home Sound Awareness System for Deaf or Hard of Hearing Users,Software Engineering,False
On Pause: How Online Instructional Videos are Used to Achieve Practical Tasks,Software Engineering,False
"""Alexa is a Toy"": Exploring Older Adults' Reasons for Using, Limiting, and Abandoning Echo",Software Engineering,False
Beyond the Prototype: Understanding the Challenge of Scaling Hardware Device Production,Software Engineering,True
Investigating Roleplaying and Identity Transformation in a Virtual Reality Narrative Experience,Software Engineering,False
Civic Empowerment through Digitalisation: The Case of Greenlandic Women,Software Engineering,False
TRACTUS: Understanding and Supporting Source Code Experimentation in Hypothesis-Driven Data Science,Software Engineering,False
Supporting Visual Artists in Programming through Direct Inspection and Control of Program Execution,Software Engineering,False
One does not Simply RSVP: Mental Workload to Select Speed Reading Parameters using Electroencephalography,Software Engineering,False
Reframing Disability as Competency: Unpacking Everyday Technology Practices of People with Visual Impairments,Software Engineering,False
Understanding Privacy-Related Questions on Stack Overflow,Software Engineering,False
Improving the Usability and UX of the Swiss Internet Voting Interface,Software Engineering,False
Personas and Analytics: A Comparative User Study of Efficiency and Effectiveness for a User Identification Task,Software Engineering,True
"Using Bayes' Theorem for Command Input: Principle, Models, and Applications",Software Engineering,False
"Manipulation, Learning, and Recall with Tangible Pen-Like Input",Software Engineering,False
Emergent Self-Regulation Practices in Technology and Social Media Use of Individuals Living with Depression,Software Engineering,False
Broadening Exposure to Socio-Political Opinions via a Pushy Smart Home Device,Software Engineering,False
OMOY: A Handheld Robotic Gadget that Shifts its Weight to Express Emotions and Intentions,Software Engineering,False
Pedagogical Agents for Fostering Question-Asking Skills in Children,Software Engineering,False
Techniques for Flexible Responsive Visualization Design,Software Engineering,True
Nailz: Sensing Hand Input with Touch Sensitive Nails,Software Engineering,False
ThreadSense: Locating Touch on an Extremely Thin Interactive Thread,Software Engineering,False
Bureaucracy as a Lens for Analyzing and Designing Algorithmic Systems,Software Engineering,False
"Sara, the Lecturer: Improving Learning in Online Education with a Scaffolding-Based Conversational Agent",Software Engineering,False
InChorus: Designing Consistent Multimodal Interactions for Data Visualization on Tablet Devices,Software Engineering,True
Keeping Community in the Loop: Understanding Wikipedia Stakeholder Values for Machine Learning-Based Systems,Software Engineering,True
Fake News on Facebook and Twitter: Investigating How People (Don't) Investigate,Software Engineering,False
Bot in the Bunch: Facilitating Group Chat Discussion by Improving Efficiency and Participation with a Chatbot,Software Engineering,False
Drone Chi: Somaesthetic Human-Drone Interaction,Software Engineering,True
Toward Immersive Self-Driving Simulations: Reports from a User Study across Six Platforms,Software Engineering,False
Would you do it?: Enacting Moral Dilemmas in Virtual Reality for Understanding Ethical Decision-Making,Software Engineering,False
Choice of Voices: A Large-Scale Evaluation of Text-to-Speech Voice Quality for Long-Form Content,Software Engineering,False
StoryMakAR: Bringing Stories to Life With An Augmented Reality & Physical Prototyping Toolkit for Youth,Software Engineering,False
"On Conducting Security Developer Studies with CS Students: Examining a Password-Storage Study with CS Students, Freelancers, and Company Developers",Software Engineering,False
Researching AI Legibility through Design,Software Engineering,False
Modeling Organizational Culture with Workplace Experiences Shared on Glassdoor,Software Engineering,False
Body Follows Eye: Unobtrusive Posture Manipulation Through a Dynamic Content Position in Virtual Reality,Software Engineering,False
Multimodal and Mixed Control of Robotic Endoscopes,Software Engineering,False
Virtual Field Studies: Conducting Studies on Public Displays in Virtual Reality,Software Engineering,False
LIFT: Integrating Stakeholder Voices into Algorithmic Team Formation,Software Engineering,False
"Composing Flexibly-Organized Step-by-Step Tutorials from Linked Source Code, Snippets, and Outputs",Software Engineering,True
TurkEyes: A Web-Based Toolbox for Crowdsourcing Attention Data,Software Engineering,False
"""I'm hoping they're an ethical company that won't do anything that I'll regret"": Users Perceptions of At-home DNA Testing Companies",Software Engineering,False
Food Literacy while Shopping: Motivating Informed Food Purchasing Behaviour with a Situated Gameful App,Software Engineering,True
"""I just leaned on it!"" Exploring Opportunistic Social Discovery of a Technologically Augmented Cushion",Software Engineering,False
HiveFive: Immersion Preserving Attention Guidance in Virtual Reality,Software Engineering,False
Textlets: Supporting Constraints and Consistency in Text Documents,Software Engineering,True
Facilitating Democracy: Concerns from Participatory Design with Asymmetric Stakeholder Relations in Health Care,Software Engineering,False
Trigeminal-based Temperature Illusions,Software Engineering,True
"CheXplain: Enabling Physicians to Explore and Understand Data-Driven, AI-Enabled Medical Imaging Analysis",Software Engineering,False
"RCEA: Real-time, Continuous Emotion Annotation for Collecting Precise Mobile Video Ground Truth Labels",Software Engineering,False
Trackly: A Customisable and Pictorial Self-Tracking App to Support Agency in Multiple Sclerosis Self-Care,Software Engineering,False
FrownOnError: Interrupting Responses from Smart Speakers by Facial Expressions,Software Engineering,True
Understanding User Perception of Automated News Generation System,Software Engineering,False
Soma Design and Sensory Misalignment,Software Engineering,True
"Factors Influencing Perceived Fairness in Algorithmic Decision-Making: Algorithm Outcomes, Development Procedures, and Individual Differences",Software Engineering,False
User-defined Swarm Robot Control,Software Engineering,True
"Platform for Studying Self-Repairing Auto-Corrections in Mobile Text Entry based on Brain Activity, Gaze, and Context",Software Engineering,False
"Non-Verbal Auditory Input for Controlling Binary, Discrete, and Continuous Input in Automotive User Interfaces",Software Engineering,False
Optimizing for Happiness and Productivity: Modeling Opportune Moments for Transitions and Breaks at Work,Software Engineering,False
"Right Information, Right Time, Right Place: Physical Alignment and Misalignment in Healthcare Practice",Software Engineering,False
Improving Reliability of Virtual Collision Responses: A Cue Integration Technique,Software Engineering,False
Craftspeople as Technical Collaborators: Lessons Learned through an Experimental Weaving Residency,Software Engineering,True
Telewalk: Towards Free and Endless Walking in Room-Scale Virtual Reality,Software Engineering,False
Eyes on the Road: Detecting Phone Usage by Drivers Using On-Device Cameras,Software Engineering,False
Support Strategies for Remote Guides in Assisting People with Visual Impairments for Effective Indoor Navigation,Software Engineering,False
Towards A Design For Life: Redesigning For Reminiscence With Looked After Children,Software Engineering,False
The Next Generation of Human-Drone Partnerships: Co-Designing an Emergency Response System,Software Engineering,True
The DELAY Framework: Designing for Extended LAtencY,Software Engineering,False
Challenges of Designing Consent: Consent Mechanics in Video Games as Models for Interactive User Agency,Software Engineering,True
RunAhead: Exploring Head Scanning based Navigation for Runners,Software Engineering,False
"Design Study ""Lite"" Methodology: Expediting Design Studies and Enabling the Synergy of Visualization Pedagogy and Social Good",Software Engineering,True
"""It Should Be a Game for Fun, Not Exercise"": Tensions in Designing Health-Related Features for Pokémon GO",Software Engineering,False
A Postmortem on Playtesting: Exploring the Impact of Playtesting on the Critical Reception of Video Games,Software Engineering,False
