Title,Category,Best Paper
Introducing Peripheral Awareness as a Neurological State for Human-computer Integration,Software Engineering,False
Venous Materials: Towards Interactive Fluidic Mechanisms,Software Engineering,False
Considering Parents in Coding Kit Design: Understanding Parents' Perspectives and Roles,Software Engineering,False
If I Hear You Correctly: Building and Evaluating Interview Chatbots with Active Listening Skills,Software Engineering,False
BlyncSync: Enabling Multimodal Smartwatch Gestures with Synchronous Touch and Blink,Software Engineering,False
Making Space for Social Sharing: Insights from a Community-Based Social Group for People with Dementia,Software Engineering,False
Phasking on Paper: Accessing a Continuum of PHysically Assisted SKetchING,Software Engineering,True
Peer-to-Peer Energy Markets: Understanding the Values of Collective and Community Trading,Software Engineering,True
AirTouch: 3D-printed Touch-Sensitive Objects Using Pneumatic Sensing,Software Engineering,False
Digital Liminalities: Understanding Isolated Communities on the Edge,Software Engineering,False
Mouillé: Exploring Wetness Illusion on Fingertips to Enhance Immersive Experience in VR,Software Engineering,False
Replicate and Reuse: Tangible Interaction Design for Digitally-Augmented Physical Media Objects,Software Engineering,False
FDHelper: Assist Unsupervised Fraud Detection Experts with Interactive Feature Selection and Evaluation,Software Engineering,False
Understanding Walking Meetings: Drivers and Barriers,Software Engineering,False
Listen to Developers! A Participatory Design Study on Security Warnings for Cryptographic APIs,Software Engineering,False
ReCog: Supporting Blind People in Recognizing Personal Objects,Software Engineering,False
Breaking The Experience: Effects of Questionnaires in VR User Studies,Software Engineering,False
"""Hey Model!"" – Natural User Interactions and Agency in Accessible Interactive 3D Models",Software Engineering,False
Meta-AR-App: An Authoring Platform for Collaborative Augmented Reality in STEM Classrooms,Software Engineering,False
PenSight: Enhanced Interaction with a Pen-Top Camera,Software Engineering,True
From Data to Insights: A Layered Storytelling Approach for Multimodal Learning Analytics,Software Engineering,False
Computing Students' Learning Difficulties in HCI Education,Software Engineering,False
Evaluating 'Prefer not to say' Around Sensitive Disclosures,Software Engineering,False
Proximate Social Factors in First-Time Contribution to Online Communities,Software Engineering,False
Data-driven Multi-level Segmentation of Image Editing Logs,Software Engineering,False
Data Everyday: Data Literacy Practices in a Division I College Sports Context,Software Engineering,True
TalkingBoogie: Collaborative Mobile AAC System for Non-verbal Children with Developmental Disabilities and Their Caregivers,Software Engineering,True
texSketch: Active Diagramming through Pen-and-Ink Annotations,Software Engineering,True
"""Out of Luck"": Socio-Economic Differences in Student Coping Responses to Technology Problems",Software Engineering,False
Exploring Auditory Information to Change Users' Perception of Time Passing as Shorter,Software Engineering,False
Place-Based Policymaking and HCI: Opportunities and Challenges for Technology Design,Software Engineering,False
Designing Clinical AAC Tablet Applications with Adults who have Mild Intellectual Disabilities,Software Engineering,True
Pronto: Rapid Augmented Reality Video Prototyping Using Sketches and Enaction,Software Engineering,False
Student Engagement in Sensitive Design Contexts: A Case Study in Dementia Care,Software Engineering,False
"Social Acceptability in HCI: A Survey of Methods, Measures, and Design Strategies",Software Engineering,True
Does Smartphone Use Drive our Emotions or vice versa? A Causal Analysis,Software Engineering,False
EAST: Early Autism Screening Tool for Preschoolers,Software Engineering,False
Why Johnny Can't Unsubscribe: Barriers to Stopping Unwanted Email,Software Engineering,False
Making Chat at Home in the Hospital: Exploring Chat Use by Nurses,Software Engineering,False
The Politics of Privacy Theories: Moving from Norms to Vulnerabilities,Software Engineering,True
What is this URL's Destination? Empirical Evaluation of Users' URL Reading,Software Engineering,False
"""Arseing around was Fun!"" – Humor as a Resource in Design and Making",Software Engineering,False
Understanding the Care Ecologies of Veterans with PTSD,Software Engineering,False
Self-Expression by Design: Co-Designing the ExpressiBall with Minimally-Verbal Children on the Autism Spectrum,Software Engineering,False
DataQuilt: Extracting Visual Elements from Images to Craft Pictorial Visualizations,Software Engineering,False
EYEditor: Towards On-the-Go Heads-Up Text Editing Using Voice and Manual Input,Software Engineering,False
"""No powers, man!"": A Student Perspective on Designing University Smart Building Interactions",Software Engineering,False
"""I Hear You, I Feel You"": Encouraging Deep Self-disclosure through a Chatbot",Software Engineering,False
"CARoma Therapy: Pleasant Scents Promote Safer Driving, Better Mood, and Improved Well-Being in Angry Drivers",Software Engineering,False
Understanding and Visualizing Data Iteration in Machine Learning,Software Engineering,False
Is This An Ad?: Automatically Disclosing Online Endorsements On YouTube With AdIntuition,Software Engineering,False
Unplatformed Design: A Model for Appropriating Social Media Technologies for Coordinated Participation,Software Engineering,False
DoughNets: Visualising Networks Using Torus Wrapping,Software Engineering,False
Addressing Cognitive and Emotional Barriers in Parent-Clinician Communication through Behavioral Visualization Webtools,Software Engineering,False
"""On Finsta, I can say 'Hail Satan'"": Being Authentic but Disagreeable on Instagram",Software Engineering,False
Inhaling and Exhaling: How Technologies Can Perceptually Extend our Breath Awareness,Software Engineering,False
Reading with the Tongue: Individual Differences Affect the Perception of Ambiguous Stimuli with the BrainPort,Software Engineering,False
Bottom-Up Organizing with Tools from On High: Understanding the Data Practices of Labor Organizers,Software Engineering,False
Move Your Body: Engaging Museum Visitors with Human-Data Interaction,Software Engineering,False
Experiential Qualities of Whispering with Voice Assistants,Software Engineering,True
Tricks and Treats: Designing Technology to Support Mobility Assistance Dogs,Software Engineering,False
3D-Auth: Two-Factor Authentication with Personalized 3D-Printed Items,Software Engineering,False
HapBead: On-Skin Microfluidic Haptic Interface using Tunable Bead,Software Engineering,False
"See No Evil, Hear No Evil, Speak No Evil: How Collegiate Players Define, Experience and Cope with Toxicity",Software Engineering,True
Live Sketchnoting Across Platforms: Exploring the Potential and Limitations of Analogue and Digital Tools,Software Engineering,False
Power Play: How the Need to Empower or Overpower Other Players Predicts Preferences in League of Legends,Software Engineering,False
Dynamics of Aimed Mid-air Movements,Software Engineering,False
Therminator: Understanding the Interdependency of Visual and On-Body Thermal Feedback in Virtual Reality,Software Engineering,False
Multimodal Gaze Interaction for Creative Design,Software Engineering,False
"The Effects of Explicit Intention Communication, Conspicuous Sensors, and Pedestrian Attitude in Interactions with Automated Vehicles",Software Engineering,False
WATouCH: Enabling Direct Input on Non-touchscreen Using Smartwatch's Photoplethysmogram and IMU Sensor Fusion,Software Engineering,False
Watch+Strap: Extending Smartwatches with Interactive StrapDisplays,Software Engineering,False
High Tempo Work: Design Challenges for Head-worn Displays in Quick Service Restaurants,Software Engineering,False
User's Role in Platform Infrastructuralization: WeChat as an Exemplar,Software Engineering,False
G-ID: Identifying 3D Prints Using Slicing Parameters,Software Engineering,False
Chase Lights in the Peripheral View: How the Design of Moving Patterns on an LED Strip Influences the Perception of Speed in an Automotive Context,Software Engineering,False
Morphic: Auto-Personalization on a Global Scale,Software Engineering,False
Clinical Documentation as End-User Programming,Software Engineering,False
Meeting Designers Where They Are: Using Industry Events as a Research Venue for HCI and Design Methods Development,Software Engineering,False
2Across: A Comparison of Audio-Tactile and Screen-Reader based Representations of a Crossword Puzzle,Software Engineering,False
Utilizing Participant Voice in Volunteer Training,Software Engineering,False
A Conversation Analysis of Non-Progress and Coping Strategies with a Banking Task-Oriented Chatbot,Software Engineering,False
Developing a Personality Model for Speech-based Conversational Agents Using the Psycholexical Approach,Software Engineering,True
Introducing the Gamer Information-Control Framework: Enabling Access to Digital Games for People with Visual Impairment,Software Engineering,False
MirrorPad: Mirror on Touchpad for Direct Pen Interaction in the Laptop Environment,Software Engineering,False
Effects of Credibility Indicators on Social Media News Sharing Intent,Software Engineering,False
Too Much Information: Questioning Security in a Post-Digital Society,Software Engineering,False
PIP Kit: An Exploratory Investigation into using Lifelogging to support Disability Benefit Claimants,Software Engineering,False
Officers Never Type: Examining the Persistence of Paper in e-Governance,Software Engineering,False
Swap: A Replacement-based Text Revision Technique for Mobile Devices,Software Engineering,False
ArguLens: Anatomy of Community Opinions On Usability Issues Using Argumentation Models,Software Engineering,False
Interpreting Interpretability: Understanding Data Scientists' Use of Interpretability Tools for Machine Learning,Software Engineering,True
Rapid Iron-On User Interfaces: Hands-on Fabrication of Interactive Textile Prototypes,Software Engineering,True
A Palette of Deepened Emotions: Exploring Emotional Challenge in Virtual Reality Games,Software Engineering,False
Truncating the Y-Axis: Threat or Menace?,Software Engineering,True
Bot or not? User Perceptions of Player Substitution with Deep Player Behavior Models,Software Engineering,False
Decoding Intent With Control Theory: Comparing Muscle Versus Manual Interface Performance,Software Engineering,False
"""All in the Same Boat"": Tradeoffs of Voice Assistant Ownership for Mixed-Visual-Ability Families",Software Engineering,False
An Interaction Design for Machine Teaching to Develop AI Tutors,Software Engineering,False
Unfabricate: Designing Smart Textiles for Disassembly,Software Engineering,False
Bridging the Virtual and Real Worlds: A Preliminary Study of Messaging Notifications in Virtual Reality,Software Engineering,False
A Human-Centered Review of Algorithms used within the U.S. Child Welfare System,Software Engineering,True
MicroMentor: Peer-to-Peer Software Help Sessions in Three Minutes or Less,Software Engineering,False
In Search of Forms for Evocative and Generative Reflection: Exploratory Studies and a Design Proposal,Software Engineering,False
Will the Crowd Game the Algorithm?: Using Layperson Judgments to Combat Misinformation on Social Media by Downranking Distrusted Sources,Software Engineering,False
BISHARE: Exploring Bidirectional Interactions Between Smartphones and Head-Mounted Augmented Reality,Software Engineering,False
MagTouch: Robust Finger Identification for a Smartwatch Using a Magnet Ring and a Built-in Magnetometer,Software Engineering,False
Teddy: A System for Interactive Review Analysis,Software Engineering,False
"E-Textile Microinteractions: Augmenting Twist with Flick, Slide and Grasp Gestures for Soft Electronics",Software Engineering,False
Evaluating the Effect of Timeline Shape on Visualization Task Performance,Software Engineering,False
OralCam: Enabling Self-Examination and Awareness of Oral Health Using a Smartphone Camera,Software Engineering,True
Investigating the Opportunities for Technologies to Enhance QoL with Stroke Survivors and their Families,Software Engineering,False
User Experiences with Online Status Indicators,Software Engineering,False
Opportunities for Enhancing Access and Efficacy of Peer Sponsorship in Substance Use Disorder Recovery,Software Engineering,False
Next Steps for Human-Computer Integration,Software Engineering,False
JumpVR: Jump-Based Locomotion Augmentation for Virtual Reality,Software Engineering,False
AutoGain: Gain Function Adaptation with Submovement Efficiency Optimization,Software Engineering,True
When the Civic Turn turns Digital: Designing Safe and Secure Refugee Resettlement,Software Engineering,False
Sociality and Skill Sharing in the Garden,Software Engineering,False
Keep Calm and Ride Along: Passenger Comfort and Anxiety as Physiological Responses to Autonomous Driving Styles,Software Engineering,False
Autocomplete Element Fields,Software Engineering,False
Sprayable User Interfaces: Prototyping Large-Scale Interactive Surfaces with Sensors and Displays,Software Engineering,False
Understanding Users' Perception Towards Automated Personality Detection with Group-specific Behavioral Data,Software Engineering,False
Re-Shape: A Method to Teach Data Ethics for Data Science Education,Software Engineering,False
ARMath: Augmenting Everyday Life with Math Learning,Software Engineering,False
How Domain Experts Create Conceptual Diagrams and Implications for Tool Design,Software Engineering,True
"The Experience of Guided Online Therapy: A Longitudinal, Qualitative Analysis of Client Feedback in a Naturalistic RCT",Software Engineering,False
Smart Home Beyond the Home: A Case for Community-Based Access Control,Software Engineering,False
"Race Yourselves: A Longitudinal Exploration of Self-Competition Between Past, Present, and Future Performances in a VR Exergame",Software Engineering,False
Do I Look Like a Criminal? Examining how Race Presentation Impacts Human Judgement of Recidivism,Software Engineering,False
It Is Your Turn: Collaborative Ideation With a Co-Creative Robot through Sketch,Software Engineering,False
"MissIt: Using Missed Calls for Free, Extremely Low Bit-Rate Communication in Developing Regions",Software Engineering,False
Examining Design Choices of Questionnaires in VR User Studies,Software Engineering,False
Unmet Needs and Opportunities for Mobile Translation AI,Software Engineering,False
Button Simulation and Design via FDVV Models,Software Engineering,False
Exploring Visual Information Flows in Infographics,Software Engineering,False
Informing the Design of Privacy-Empowering Tools for the Connected Home,Software Engineering,False
Virtual Reality Games for People Using Wheelchairs,Software Engineering,False
A View on the Viewer: Gaze-Adaptive Captions for Videos,Software Engineering,True
Emoji Accessibility for Visually Impaired People,Software Engineering,False
BodyLights: Open-Ended Augmented Feedback to Support Training Towards a Correct Exercise Execution,Software Engineering,False
ShArc: A Geometric Technique for Multi-Bend/Shape Sensing,Software Engineering,True
Robots for Inclusive Play: Co-designing an Educational Game With Visually Impaired and sighted Children,Software Engineering,True
Cheat Sheets for Data Visualization Techniques,Software Engineering,False
Learn with Haptics: Improving Vocabulary Recall with Free-form Digital Annotation on Touchscreen Mobiles,Software Engineering,False
Guess the Data: Data Work to Understand How People Make Sense of and Use Simple Sensor Data from Homes,Software Engineering,False
Please Call the Specialism: Using WeChat to Support Patient Care in China,Software Engineering,True
"Monsters, Metaphors, and Machine Learning",Software Engineering,False
Collective Support and Independent Learning with a Voice-Based Literacy Technology in Rural Communities,Software Engineering,False
The TA Framework: Designing Real-time Teaching Augmentation for K-12 Classrooms,Software Engineering,False
"""We have been magnified for years - Now you are under the microscope!"": Co-researchers with Learning Disabilities Created an Online Survey to Challenge Public Understanding of Learning Disabilities",Software Engineering,False
Beyond Team Makeup: Diversity in Teams Predicts Valued Outcomes in Computer-Mediated Collaborations,Software Engineering,False
"Defining Haptic Experience: Foundations for Understanding, Communicating, and Evaluating HX",Software Engineering,True
MaraVis: Representation and Coordinated Intervention of Medical Encounters in Urban Marathon,Software Engineering,False
Emotional Footprints of Email Interruptions,Software Engineering,False
Nationality and Gender Biases in Multicultural Online Learning Environments: The Effects of Anonymity,Software Engineering,False
Designing for Employee Voice,Software Engineering,False
Supporting Software Developers' Focused Work on Window-Based Desktops,Software Engineering,False
MoveVR: Enabling Multiform Force Feedback in Virtual Reality using Household Cleaning Robot,Software Engineering,False
Between Scripts and Applications: Computational Media for the Frontier of Nanoscience,Software Engineering,False
Brainsourcing: Crowdsourcing Recognition Tasks via Collaborative Brain-Computer Interfacing,Software Engineering,False
Mixed Reality Light Fields for Interactive Remote Assistance,Software Engineering,False
Expert Discussions Improve Comprehension of Difficult Cases in Medical Image Assessment,Software Engineering,False
Collaborative Technologies for Children with Special Needs: A Systematic Literature Review,Software Engineering,False
Miniature Haptics: Experiencing Haptic Feedback through Hand-based and Embodied Avatars,Software Engineering,True
Digital Juries: A Civics-Oriented Approach to Platform Governance,Software Engineering,False
"Patriarchy, Maternal Health and Spiritual Healing: Designing Maternal Health Interventions in Pakistan",Software Engineering,False
BrailleBlocks: Computational Braille Toys for Collaborative Learning,Software Engineering,False
Investigating the Necessity of Delay in Marking Menu Invocation,Software Engineering,False
GoTree: A Grammar of Tree Visualizations,Software Engineering,False
Measuring Identity Confusion with Uniform Resource Locators,Software Engineering,False
Understanding Older Adults' Participation in Design Workshops,Software Engineering,False
Is Too Much System Caution Counterproductive? Effects of Varying Sensitivity and Automation Levels in Vehicle Collision Avoidance Systems,Software Engineering,True
"Re-examining Whether, Why, and How Human-AI Interaction Is Uniquely Difficult to Design",Software Engineering,True
Designing IoT Resources to Support Outdoor Play for Children,Software Engineering,False
Knock on Wood: Combining Redirected Touching and Physical Props for Tool-Based Interaction in Virtual Reality,Software Engineering,False
Wearable Microphone Jamming,Software Engineering,True
Embroidered Resistive Pressure Sensors: A Novel Approach for Textile Interfaces,Software Engineering,False
BiTipText: Bimanual Eyes-Free Text Entry on a Fingertip Keyboard,Software Engineering,False
"The Critical Catalog: Library Information Systems, Tricksterism, and Social Justice",Software Engineering,False
"""My Library Has Just Been Obliterated"": Producing New Norms of Use Via Software Update",Software Engineering,True
"""Energy is a Finite Resource"": Designing Technology to Support Individuals across Fluctuating Symptoms of Depression",Software Engineering,False
An Honest Conversation: Transparently Combining Machine and Human Speech Assistance in Public Spaces,Software Engineering,False
Social Boundaries for Personal Agents in the Interpersonal Space of the Home,Software Engineering,False
A Change of Perspective: How User Orientation Influences the Perception of Physicalizations,Software Engineering,False
Gripmarks: Using Hand Grips to Transform In-Hand Objects into Mixed Reality Input,Software Engineering,False
The Upcycled Home: Removing Barriers to Lightweight Modification of the Home's Everyday Objects,Software Engineering,False
"Adhering, Steering, and Queering: Treatment of Gender in Natural Language Generation",Software Engineering,False
Mental Models of AI Agents in a Cooperative Game Setting,Software Engineering,True
TAGSwipe: Touch Assisted Gaze Swipe for Text Entry,Software Engineering,False
Studying the Effects of Cognitive Biases in Evaluation of Conversational Agents,Software Engineering,True
Personal Space in Play: Physical and Digital Boundaries in Large-Display Cooperative and Competitive Games,Software Engineering,False
"""Hi! I am the Crowd Tasker"" Crowdsourcing through Digital Voice Assistants",Software Engineering,False
Dark Patterns after the GDPR: Scraping Consent Pop-ups and Demonstrating their Influence,Software Engineering,False
WithYou: Automated Adaptive Speech Tutoring With Context-Dependent Speech Recognition,Software Engineering,True
ThermalRing: Gesture and Tag Inputs Enabled by a Thermal Imaging Smart Ring,Software Engineering,False
Predicting and Diagnosing User Engagement with Mobile UI Animation via a Data-Driven Approach,Software Engineering,False
Color and Animation Preferences for a Light Band eHMI in Interactions Between Automated Vehicles and Pedestrians,Software Engineering,True
A Participatory Simulation of the Accountable Capitalism Act,Software Engineering,False
"GUIComp: A GUI Design Assistant with Real-Time, Multi-Faceted Feedback",Software Engineering,False
Searching for Mental Health: A Mixed-Methods Study of Young People's Online Help-seeking,Software Engineering,False
Culture in Action: Unpacking Capacities to Inform Assets-Based Design,Software Engineering,True
MRAT: The Mixed Reality Analytics Toolkit,Software Engineering,True
Investigating the Effects of Self-Avatars and Story-Relevant Avatars on Children's Creative Storytelling,Software Engineering,False
Restorative Play: Videogames Improve Player Wellbeing After a Need-Frustrating Event,Software Engineering,False
"PneuSleeve: In-fabric Multimodal Actuation and Sensing in a Soft, Compact, and Expressive Haptic Sleeve",Software Engineering,True
Teenage Visitor Experience: Classification of Behavioral Dynamics in Museums,Software Engineering,False
Vibrotactile Funneling Illusion and Localization Performance on the Head,Software Engineering,False
Modeling the Endpoint Uncertainty in Crossing-based Moving Target Selection,Software Engineering,True
"""I Feel Like This is a Bad Thing"": Investigating Disassembly in Action for Novices",Software Engineering,False
"""Human, All Too Human"": NOAA Weather Radio and the Emotional Impact of Synthetic Voices",Software Engineering,False
Privacy and Activism in the Transgender Community,Software Engineering,False
Improving Humans' Ability to Interpret Deictic Gestures in Virtual Reality,Software Engineering,False
Understanding Client Support Strategies to Improve Clinical Outcomes in an Online Mental Health Intervention,Software Engineering,False
IoT Data in the Home: Observing Entanglements and Drawing New Encounters,Software Engineering,False
Interactive Multisensory Environments for Primary School Children,Software Engineering,False
Parenting with Alexa: Exploring the Introduction of Smart Speakers on Family Dynamics,Software Engineering,False
Making Design Memoirs: Understanding and Honoring Difficult Experiences,Software Engineering,True
The Influence of Decaying the Representation of Older Social Media Content on Simulated Hiring Decisions,Software Engineering,False
Sensor Illumination: Exploring Design Qualities and Ethical Implications of Smart Cameras and Image/Video Analytics,Software Engineering,False
Dear Pictograph: Investigating the Role of Personalization and Immersion for Consuming and Enjoying Visualizations,Software Engineering,False
"Explore, Create, Annotate: Designing Digital Drawing Tools with Visually Impaired People",Software Engineering,False
A Comparison of Geographical Propagation Visualizations,Software Engineering,False
Understanding Women Modders using the Serious Leisure Perspective,Software Engineering,False
I am Not an Object: Reframing 3D Body Scanning for Co-Design,Software Engineering,False
Virtual Reality Without Vision: A Haptic and Auditory White Cane to Navigate Complex Virtual Worlds,Software Engineering,True
Clash of Times: Respectful Technology Space for Integrating Community Stories in Intangible Exhibits,Software Engineering,False
Transforming Robot Programs Based on Social Context,Software Engineering,False
"Digital Technology, Meditative and Contemplative Practices, and Transcendent Experiences",Software Engineering,False
The Silent Conversation: Designing for Introspection and Social Play in Art Museums,Software Engineering,False
PoCoPo: Handheld Pin-based Shape Display for Haptic Rendering in Virtual Reality,Software Engineering,False
Understanding Parenting Stress through Co-designed Self-Trackers,Software Engineering,False
Investigating User-Created Gamification in an Image Tagging Task,Software Engineering,False
Supporting Stimulation Needs in Dementia Care through Wall-Sized Displays,Software Engineering,True
Designing Mental Health Technologies that Support the Social Ecosystem of College Students,Software Engineering,False
Community Collectives: Low-tech Social Support for Digitally-Engaged Entrepreneurship,Software Engineering,True
Designing Distributed Ledger Technologies for Social Change: The Case of CariCrop,Software Engineering,False
Du Bois Wrapped Bar Chart: Visualizing Categorical Data with Disproportionate Values,Software Engineering,False
PhysioSkin: Rapid Fabrication of Skin-Conformal Physiological Interfaces,Software Engineering,False
