Title,Category,Best Paper
"Tactile Presentation of Network Data: Text, Matrix or Diagram?",Software Engineering,False
"PV-Tiles: Towards Closely-Coupled Photovoltaic and Digital Materials for Useful, Beautiful and Sustainable Interactive Surfaces",Software Engineering,False
Celebrating Everyday Success: Improving Engagement and Motivation using a System for Recording Daily Highlights,Software Engineering,False
Shaping the Design of Smartphone-Based Interventions for Self-Harm,Software Engineering,False
"Embedding a VR Game Studio in a Sedentary Workplace: Use, Experience and Exercise Benefits",Software Engineering,False
Embodiment Effects in Interactions with Failing Robots,Software Engineering,False
PuffPacket: A Platform for Unobtrusively Tracking the Fine-grained Consumption Patterns of E-cigarette Users,Software Engineering,False
WeDA: Designing and Evaluating A Scale-driven Wearable Diagnostic Assessment System for Children with ADHD,Software Engineering,False
Crowdsourced Detection of Emotionally Manipulative Language,Software Engineering,False
Conversational Agency in Augmentative and Alternative Communication,Software Engineering,True
Prior Setting in Practice: Strategies and Rationales Used in Choosing Prior Distributions for Bayesian Analysis,Software Engineering,False
Pac-Euglena: A Living Cellular Pac-Man Meets Virtual Ghosts,Software Engineering,False
Proxemics Beyond Proximity: Designing for Flexible Social Interaction Through Cross-Device Interaction,Software Engineering,False
Decipher: An Interactive Visualization Tool for Interpreting Unstructured Design Feedback from Multiple Providers,Software Engineering,False
Evaluating Multivariate Network Visualization Techniques Using a Validated Design and Crowdsourcing Approach,Software Engineering,False
Enabling Data-Driven API Design with Community Usage Data: A Need-Finding Study,Software Engineering,False
Synthesized Social Signals: Computationally-Derived Social Signals from Account Histories,Software Engineering,False
Evaluating the Information Security Awareness of Smartphone Users,Software Engineering,True
Choice-Point: Fostering Awareness and Choice with Perpetrators in Domestic Violence Interventions,Software Engineering,False
Sensock: 3D Foot Reconstruction with Flexible Sensors,Software Engineering,False
Tabloidization versus Credibility: Short Term Gain for Long Term Pain,Software Engineering,False
Informing the Design of a Personalized Privacy Assistant for the Internet of Things,Software Engineering,False
Snapstream: Snapshot-based Interaction in Live Streaming for Visual Art,Software Engineering,False
Preparing for the Unexpected: Community Framework for Social Media Use and Social Support by Trail Thru-Hikers,Software Engineering,False
Critical Race Theory for HCI,Software Engineering,True
Exploring Eyes-free Bezel-initiated Swipe on Round Smartwatches,Software Engineering,False
The Low/High Index of Pupillary Activity,Software Engineering,False
Capturing Experts' Mental Models to Organize a Collection of Haptic Devices: Affordances Outweigh Attributes,Software Engineering,False
Supporting Self-Injury Recovery: The Potential for Virtual Reality Intervention,Software Engineering,False
Learning from Positive Adaptations of Pediatric Cancer Patients to Design Health Technologies,Software Engineering,False
Pedestrian Detection with Wearable Cameras for the Blind: A Two-way Perspective,Software Engineering,False
Urban Mosaic: Visual Exploration of Streetscapes Using Large-Scale Image Data,Software Engineering,False
Let's Talk about Sext: How Adolescents Seek Support and Advice about Their Online Sexual Experiences,Software Engineering,False
"See, Feel, Move: Player Behaviour Analysis through Combined Visualization of Gaze, Emotions, and Movement",Software Engineering,False
Exploring Human-Robot Interaction with the Elderly: Results from a Ten-Week Case Study in a Care Home,Software Engineering,False
Improving Worker Engagement Through Conversational Microtask Crowdsourcing,Software Engineering,False
"""Person, Shoes, Tree. Is the Person Naked?"" What People with Vision Impairments Want in Image Descriptions",Software Engineering,False
Utilizing VR and Gaze Tracking to Develop AR Solutions for Industrial Maintenance,Software Engineering,False
Evaluating Smartwatch-based Sound Feedback for Deaf and Hard-of-hearing Users Across Contexts,Software Engineering,False
Play-Based Design: Giving 3- to 4-Year-Old Children a Voice in the Design Process,Software Engineering,False
ElastOscillation: 3D Multilevel Force Feedback for Damped Oscillation on VR Controllers,Software Engineering,False
Levitation Simulator: Prototyping Ultrasonic Levitation Interfaces in Virtual Reality,Software Engineering,True
"Crafting Personal Information - Resistance, Imperfection, and Self-Creation in Bullet Journaling",Software Engineering,False
"Companionship Is Not a Function: The Effect of a Novel Robotic Object on Healthy Older Adults' Feelings of ""Being-Seen""",Software Engineering,False
GPkit: A Human-Centered Approach to Convex Optimization in Engineering Design,Software Engineering,False
Designing Games for Healthy Sleep,Software Engineering,False
"Learning Through Exploration: How Children, Adults, and Older Adults Interact with a New Feature-Rich Application",Software Engineering,False
Taking Data Out of Context to Hyper-Personalize Ads: Crowdworkers' Privacy Perceptions and Decisions to Disclose Private Information,Software Engineering,False
What Are You Talking To?: Understanding Children's Perceptions of Conversational Agents,Software Engineering,False
Moving Toward an Ecologically Valid Data Collection Protocol for 2D Gestures In Video Games,Software Engineering,False
Toward Automated Feedback on Teacher Discourse to Enhance Teacher Learning,Software Engineering,False
Inducing and Mitigating Stereotype Threat Through Gendered Virtual Body-Swap Illusions,Software Engineering,False
Surfacing Visualization Mirages,Software Engineering,True
FoodFab: Creating Food Perception Illusions using Food 3D Printing,Software Engineering,False
Collaborative Writing Across Multiple Artifact Ecologies,Software Engineering,False
Enemy Within: Long-term Motivation Effects of Deep Player Behavior Models for Dynamic Difficulty Adjustment,Software Engineering,False
"Random, Messy, Funny, Raw: Finstas as Intimate Reconfigurations of Social Media",Software Engineering,True
Jubilee: An Extensible Machine for Multi-tool Fabrication,Software Engineering,False
Using Diaries to Probe the Illness Experiences of Adolescent Patients and Parental Caregivers,Software Engineering,False
Soundr: Head Position and Orientation Prediction Using a Microphone Array,Software Engineering,False
Crowdsourcing the Perception of Machine Teaching,Software Engineering,False
High Water Pants: Designing Embodied Environmental Speculation,Software Engineering,False
The Designer's Body as Resource in Design: Exploring Combinations of Point-of-view and Tense,Software Engineering,False
Molder: An Accessible Design Tool for Tactile Maps,Software Engineering,False
Approach Matters: Linking Practitioner Approaches to Technology Design for People with Dementia,Software Engineering,False
"Designing and Evaluating 'In the Same Boat', A Game of Embodied Synchronization for Enhancing Social Play",Software Engineering,False
Camera Adversaria,Software Engineering,False
How Well Do People Report Time Spent on Facebook?: An Evaluation of Established Survey Questions with Recommendations,Software Engineering,False
Augmenting Static Visualizations with PapARVis Designer,Software Engineering,False
Temporal Segmentation of Creative Live Streams,Software Engineering,False
Outline Pursuits: Gaze-assisted Selection of Occluded Objects in Virtual Reality,Software Engineering,False
"Engaging the Commons in Participatory Sensing: Practice, Problems, and Promise in the Context of Dockless Bikesharing",Software Engineering,False
Evaluating the End-User Experience of Private Browsing Mode,Software Engineering,False
PalmBoard: Leveraging Implicit Touch Pressure in Statistical Decoding for Indirect Text Entry,Software Engineering,False
Wrex: A Unified Programming-by-Example Interaction for Synthesizing Readable Code for Data Scientists,Software Engineering,True
Automatic Annotation Synchronizing with Textual Description for Visualization,Software Engineering,False
Assessing Severity of Pulmonary Obstruction from Respiration Phase-Based Wheeze-Sensing Using Mobile Sensors,Software Engineering,False
Co-Designing Checklists to Understand Organizational Challenges and Opportunities around Fairness in AI,Software Engineering,True
Recognizing Affiliation: Using Behavioural Traces to Predict the Quality of Social Interactions in Online Games,Software Engineering,False
Silva: Interactively Assessing Machine Learning Fairness Using Causality,Software Engineering,False
Transparency of CHI Research Artifacts: Results of a Self-Reported Survey,Software Engineering,True
Quantification of Users' Visual Attention During Everyday Mobile Device Interactions,Software Engineering,False
Investigating User Expectations on the Roles of Family-shared AI Speakers,Software Engineering,False
Tempura: Query Analysis with Structural Templates,Software Engineering,False
C-Space: An Interactive Prototyping Platform for Collaborative Spatial Design Exploration,Software Engineering,False
"Metaprobes, Metaphysical Workshops and Sketchy Philosophy",Software Engineering,False
How Visualizing Inferential Uncertainty Can Mislead Readers About Treatment Effects in Scientific Results,Software Engineering,True
Integrated Development Environment with Interactive Scatter Plot for Examining Statistical Modeling,Software Engineering,False
Many Faced Hate: A Cross Platform Study of Content Framing and Information Sharing by Online Hate Groups,Software Engineering,False
How Mandatory Second Factor Affects the Authentication User Experience,Software Engineering,False
Supporting the Supporters of Unaccompanied Migrant Youth: Designing for Social-ecological Resilience,Software Engineering,False
Dimensions of UX Practice that Shape Ethical Awareness,Software Engineering,False
Storytelling to Sensemaking: A Systematic Framework for Designing Auditory Description Display for Interactives,Software Engineering,False
Empathy Is All You Need: How a Conversational Agent Should Respond to Verbal Abuse,Software Engineering,False
Brooke Leave Home: Designing a Personalized Film to Support Public Engagement with Open Data,Software Engineering,False
Automation and Creativity: A Case Study of DJs' and VJs' Ambivalent Positions on Automated Visual Software,Software Engineering,False
From Creating Spaces for Civic Discourse to Creating Resources for Action,Software Engineering,False
"""Like Shock Absorbers"": Understanding the Human Infrastructures of Technology-Mediated Mental Health Support",Software Engineering,False
A Probabilistic Grammar of Graphics,Software Engineering,True
Answering Questions about Charts and Generating Visual Explanations,Software Engineering,False
Adults' and Children's Mental Models for Gestural Interactions with Interactive Spherical Displays,Software Engineering,False
Towards Value-Adaptive Instruction: A Data-Driven Method for Addressing Bias in Argument Evaluation Tasks,Software Engineering,False
Wireality: Enabling Complex Tangible Geometries in Virtual Reality with Worn Multi-String Haptics,Software Engineering,True
Touching and Being in Touch with the Menstruating Body,Software Engineering,True
Towards Inclusive External Communication of Autonomous Vehicles for Pedestrians with Vision Impairments,Software Engineering,True
Crowdsourcing in China: Exploring the Work Experiences of Solo Crowdworkers and Crowdfarm Workers,Software Engineering,False
Co-designing Digital Tools to Enhance Speech and Language Therapy Training in Ghana,Software Engineering,False
Toward Future-Centric Personal Informatics: Expecting Stressful Events and Preparing Personalized Interventions in Stress Management,Software Engineering,False
Haptic-go-round: A Surrounding Platform for Encounter-type Haptics in Virtual Reality Experiences,Software Engineering,False
Weaving by Touch: A Case Analysis of Accessible Making,Software Engineering,True
Designing Ambient Narrative-Based Interfaces to Reflect and Motivate Physical Activity,Software Engineering,True
Enhancing Mobile Voice Assistants with WorldGaze,Software Engineering,False
Toward the Design of Enjoyable Games for Children with Fetal Alcohol Spectrum Disorder,Software Engineering,False
FaceHaptics: Robot Arm based Versatile Facial Haptics for Immersive Environments,Software Engineering,False
"Social Comparison and Facebook: Feedback, Positivity, and Opportunities for Comparison",Software Engineering,False
KeyMap: Improving Keyboard Shortcut Vocabulary Using Norman's Mapping,Software Engineering,False
A Longitudinal Video Study on Communicating Status and Intent for Self-Driving Vehicle – Pedestrian Interaction,Software Engineering,False
"Debugging Database Queries: A Survey of Tools, Techniques, and Users",Software Engineering,False
FamilyStories: Asynchronous Audio Storytelling for Family Members Across Time Zones,Software Engineering,True
Detecting Gender Stereotypes: Lexicon vs. Supervised Learning Methods,Software Engineering,True
Head-Coupled Kinematic Template Matching: A Prediction Model for Ray Pointing in VR,Software Engineering,False
CreaTable Content and Tangible Interaction in Aphasia,Software Engineering,True
Touch me Gently: Recreating the Perception of Touch using a Shape-Memory Alloy Matrix,Software Engineering,False
Designing for Social Interaction in the Age of Excessive Smartphone Use,Software Engineering,False
Giving Voice to Silent Data: Designing with Personal Music Listening History,Software Engineering,False
Projection Boxes: On-the-fly Reconfigurable Visualization for Live Programming,Software Engineering,False
When Design Novices and LEGO® Meet: Stimulating Creative Thinking for Interface Design,Software Engineering,False
Framing Effects Influence Interface Feature Decisions,Software Engineering,False
"""'More gay' fits in better"": Intracommunity Power Dynamics and Harms in Online LGBTQ+ Spaces",Software Engineering,False
Towards A Taxonomy of Content Sensitivity and Sharing Preferences for Photos,Software Engineering,False
E-scooters on the Ground: Lessons for Redesigning Urban Micro-Mobility,Software Engineering,False
GridAlert: Using a Sensor-Based Technology to Monitor Power Blackouts in Kenyan Homes,Software Engineering,False
Exploring the Design Space of User-System Communication for Smart-home Routine Assistants,Software Engineering,False
A Literature Review of Quantitative Persona Creation,Software Engineering,False
Digital Ventriloquism: Giving Voice to Everyday Objects,Software Engineering,False
Affective State Prediction Based on Semi-Supervised Learning from Smartphone Touch Data,Software Engineering,False
Glissade: Generating Balance Shifting Feedback to Facilitate Auxiliary Digital Pen Input,Software Engineering,True
Ambiguity-aware AI Assistants for Medical Data Analysis,Software Engineering,False
Becoming a Robot - Overcoming Anthropomorphism with Techno-Mimesis,Software Engineering,False
Understanding what you feel: A Mobile Audio-Tactile System for Graphics Used at Schools with Students with Visual Impairment,Software Engineering,False
"Digital-Enabled Last Mile: A Study of Passenger Trips in Rural, Low-density Populated Areas",Software Engineering,False
Integrating the Digital and the Traditional to Deliver Therapy for Depression: Lessons from a Pragmatic Study,Software Engineering,False
"""It's a scavenger hunt"": Usability of Websites' Opt-Out and Data Deletion Choices",Software Engineering,False
Chasm: A Screw Based Expressive Compact Haptic Actuator,Software Engineering,True
TangibleCircuits: An Interactive 3D Printed Circuit Education Tool for People with Visual Impairments,Software Engineering,True
Music Creation by Example,Software Engineering,False
Infrastructural Speculations: Tactics for Designing and Interrogating Lifeworlds,Software Engineering,False
The Effectiveness of Visual and Audio Wayfinding Guidance on Smartglasses for People with Low Vision,Software Engineering,False
Exploring the Potential of an Intelligent Tutoring System for Sketching Fundamentals,Software Engineering,False
Reinforcement Learning for the Adaptive Scheduling of Educational Activities,Software Engineering,True
Generating Audio-Visual Slideshows from Text Articles Using Word Concreteness,Software Engineering,False
EmoG: Supporting the Sketching of Emotional Expressions for Storyboarding,Software Engineering,False
"Awareness, Understanding, and Action: A Conceptual Framework of User Experiences and Expectations about Indoor Air Quality Visualizations",Software Engineering,False
Designing Voice Interfaces: Back to the (Curriculum) Basics,Software Engineering,False
RoomShift: Room-scale Dynamic Haptics for VR with Furniture-moving Swarm Robots,Software Engineering,False
Explain like I am a Scientist: The Linguistic Barriers of Entry to r/science,Software Engineering,False
A Design Engineering Approach for Quantitatively Exploring Context-Aware Sentence Retrieval for Nonspeaking Individuals with Motor Disabilities,Software Engineering,True
Expanding Modes of Reflection in Design Futuring,Software Engineering,False
Progression Maps: Conceptualizing Narrative Structure for Interaction Design Support,Software Engineering,False
"Designers in White Coats: Deploying Ovum, a Fertility Tracking Device",Software Engineering,False
Amazon vs. My Brother: How Users of Shared Smart Speakers Perceive and Cope with Privacy Risks,Software Engineering,True
Opportunities and Challenges in Involving Users in Project-Based HCI Education,Software Engineering,True
"ReFind: Design, Lived Experience and Ongoingness in Bereavement",Software Engineering,True
Foundations for Designing Public Interactive Displays that Provide Value to Users,Software Engineering,False
"Paths Explored, Paths Omitted, Paths Obscured: Decision Points & Selective Reporting in End-to-End Data Analysis",Software Engineering,False
Robustness of Eye Movement Biometrics Against Varying Stimuli and Varying Trajectory Length,Software Engineering,False
Manufacturing Change: The Impact of Virtual Environments on Real Organizations,Software Engineering,False
Heartbeats in the Wild: A Field Study Exploring ECG Biometrics in Everyday Life,Software Engineering,True
Augmented Reality to Enable Users in Learning Case Grammar from Their Real-World Interactions,Software Engineering,True
Retroactive Transfer Phenomena in Alternating User Interfaces,Software Engineering,False
"Designing and Evaluating Calmer, a Device for Simulating Maternal Skin-to-Skin Holding for Premature Infants",Software Engineering,True
"""It's in my other hand!"" – Studying the Interplay of Interaction Techniques and Multi-Tablet Activities",Software Engineering,False
CollabAR – Investigating the Mediating Role of Mobile AR Interfaces on Co-Located Group Collaboration,Software Engineering,False
Political Hashtags & the Lost Art of Democratic Discourse,Software Engineering,True
ProtoSpray: Combining 3D Printing and Spraying to Create Interactive Displays with Arbitrary Shapes,Software Engineering,True
GAZED– Gaze-guided Cinematic Editing of Wide-Angle Monocular Video Recordings,Software Engineering,False
On Being Iterated: The Affective Demands of Design Participation,Software Engineering,True
Classification of Functional Attention in Video Meetings,Software Engineering,False
Collaborative or Simply Uncaged? Understanding Human-Cobot Interactions in Automation,Software Engineering,False
Characterizing Twitter Users Who Engage in Adversarial Interactions against Political Candidates,Software Engineering,True
Private Responses for Public Sharing: Understanding Self-Presentation and Relational Maintenance via Stories in Social Media,Software Engineering,False
A User Study on Mixed Reality Remote Collaboration with Eye Gaze and Hand Gesture Sharing,Software Engineering,False
Will Deleting History Make Alexa More Trustworthy?: Effects of Privacy and Content Customization on User Experience of Smart Speakers,Software Engineering,False
MagneLayer: Force Field Fabrication by Layered Magnetic Sheets,Software Engineering,True
GRIDS: Interactive Layout Design with Integer Programming,Software Engineering,False
Too Hot to Handle: An Evaluation of the Effect of Thermal Visual Representation on User Grasping Interaction in Virtual Reality,Software Engineering,False
Trust versus Privacy: Using Connected Car Data in Peer-to-Peer Carsharing,Software Engineering,False
Evaluation of a Financial Portfolio Visualization using Computer Displays and Mixed Reality Devices with Domain Experts,Software Engineering,False
Virtually-Extended Proprioception: Providing Spatial Reference in VR through an Appended Virtual Limb,Software Engineering,False
Un-authorised View: Leveraging Volunteer Expertise in Heritage,Software Engineering,False
Chameleon: Bringing Interactivity to Static Digital Documents,Software Engineering,False
Exploring The Future of Data-Driven Product Design,Software Engineering,False
Alexa as Coach: Leveraging Smart Speakers to Build Social Agents that Reduce Public Speaking Anxiety,Software Engineering,False
Do You Feel Like Passing Through Walls?: Effect of Self-Avatar Appearance on Facilitating Realistic Behavior in Virtual Environments,Software Engineering,True
Automatic Text Simplification Tools for Deaf and Hard of Hearing Adults: Benefits of Lexical Simplification and Providing Users with Autonomy,Software Engineering,False
Whither Humane-Computer Interaction? Adult and Child Value Conflicts in the Biometric Fingerprinting for Food,Software Engineering,False
Augmented Reality for Older Adults: Exploring Acceptability of Virtual Coaches for Home-based Balance Training in an Aging Population,Software Engineering,False
Faces of Focus: A Study on the Facial Cues of Attentional States,Software Engineering,False
Why do people watch others eat food? An Empirical Study on the Motivations and Practices of Mukbang Viewers,Software Engineering,False
The Care Work of Access,Software Engineering,False
"""Nobody Speaks that Fast!"" An Empirical Study of Speech Rate in Conversational Agents for People with Vision Impairments",Software Engineering,True
"Examining the Adoption and Abandonment of Security, Privacy, and Identity Theft Protection Practices",Software Engineering,True
Introducing Gamettes: A Playful Approach for Capturing Decision-Making for Informing Behavioral Models,Software Engineering,True
"Others' Images: Online Social Media, Architectural Improvisations, and Spatial Marginalization in Bangladesh",Software Engineering,True
"Being (In)Visible: Privacy, Transparency, and Disclosure in the Self-Management of Bipolar Disorder",Software Engineering,False
Walking by Cycling: A Novel In-Place Locomotion User Interface for Seated Virtual Reality Experiences,Software Engineering,False
Does Context in Privacy Communication Really Matter? — A Survey on Consumer Concerns and Preferences,Software Engineering,False
"Senorita: A Chorded Keyboard for Sighted, Low Vision, and Blind Mobile Users",Software Engineering,False
The Role of Everyday Sounds in Advanced Dementia Care,Software Engineering,True
GazeConduits: Calibration-Free Cross-Device Collaboration through Gaze and Touch,Software Engineering,False
Leveraging Error Correction in Voice-based Text Entry by Talk-and-Gaze,Software Engineering,False
Considerations for Implementing Technology to Support Community Radio in Rural Communities,Software Engineering,False
Towards More Universal Wayfinding Technologies: Navigation Preferences Across Disabilities,Software Engineering,False
Reflexive VR Storytelling Design Beyond Immersion: Facilitating Self-Reflection on Death and Loneliness,Software Engineering,False
"Awareness, Navigation, and Use of Feed Control Settings Online",Software Engineering,False
SleepBandits: Guided Flexible Self-Experiments for Sleep,Software Engineering,False
I'm All Eyes and Ears: Exploring Effective Locators for Privacy Awareness in IoT Scenarios,Software Engineering,False
Is Your Time Well Spent? Reflecting on Knowledge Work More Holistically,Software Engineering,False
"Attenuated Access: Accounting for Startup, Maintenance, and Affective Costs in Resource-Constrained Communities",Software Engineering,False
A Rapid Tapping Task on Commodity Smartphones to Assess Motor Fatigability,Software Engineering,False
Optimizing User Interface Layouts via Gradient Descent,Software Engineering,False
Questioning the AI: Informing Design Practices for Explainable AI User Experiences,Software Engineering,True
The Emerging Professional Practice of Remote Sighted Assistance for People with Visual Impairments,Software Engineering,False
Understanding Viewport- and World-based Pointing with Everyday Smart Devices in Immersive Augmented Reality,Software Engineering,False
Scout: Rapid Exploration of Interface Layout Alternatives through High-Level Design Constraints,Software Engineering,False
Prehabilitation: Care Challenges and Technological Opportunities,Software Engineering,False
"""You Don't Have To Know My Past"": How WeChat Moments Users Manage Their Evolving Self-Presentation",Software Engineering,False
Affect Recognition using Psychophysiological Correlates in High Intensity VR Exergaming,Software Engineering,False
Computational Alternatives Vignettes for Place- and Activity-Centered Digital Services in Public Libraries,Software Engineering,False
"""And This, Kids, Is How I Met Your Mother"": Consumerist, Mundane, and Uncanny Futures with Sex Robots",Software Engineering,False
Neo-Noumena: Augmenting Emotion Communication,Software Engineering,False
